{
  "schemaVersion": "1.0.0",
  "runId": "01J9E0000000000000000RN1",
  "projectRef": {
    "gitRemote": "https://github.com/owner/target-repo.git",
    "fonebrewProjectHint": "core-mobile"
  },
  "sourceCommit": "ab3567ecf1a2b3c4d5e6f7089a1b2c3d4e5f6789",
  "assayCommit": "cd7890ab1c2d3e4f5061728394a5b6c7d8e9f01",
  "tool": { "name": "assay-cli", "version": "0.9.2" },
  "startedAt": "2026-08-06T02:00:00Z",
  "finishedAt": "2026-08-06T02:14:00Z",
  "findingFiles": [
    { "path": "findings.sarif", "sha256": "fe943a5951937392e255d625e6093e3045d992be85dc0821573517d0b03e3a9d", "count": 7 },
    { "path": "findings.json", "sha256": "cdfaffbe111e0b693aea1146f910c39070161c566f3ce4ba7b475fffab31ba4c", "count": 7 }
  ],
  "provingTests": { "path": "proving-tests.v1.json", "count": 3 },
  "completeness": "COMPLETE",
  "explanation": null,
  "unknownFields": {}
}
